{
  "schema_version": "0.3",
  "contract_kind": "lane_decision",
  "decision_id": "ld-001",
  "proposal_id": "tp-001",
  "created_at": "2026-04-28T00:01:00Z",
  "metadata": {"policy_rule_matched": "bugfix-low-risk", "policy_version": "2026.04.28"},
  "lane": "coding_agent",
  "executor": "claude_cli",
  "backend": "team_executor",
  "rationale": "task_type=bug_fix + risk=low routed to claude_cli via team_executor.",
  "confidence": 0.92,
  "alternatives": [
    {
      "lane": "coding_agent",
      "executor": "codex_cli",
      "backend": "direct_local",
      "confidence": 0.55,
      "reason": "fallback if claude_cli unavailable"
    }
  ]
}
